{
  "agent": "messaging_framework",
  "company": "docebo-agenthub",
  "scenario_type": "new_product_launch",
  "generated_at": "2026-06-14T00:00:00Z",
  "section_a_narrative": {
    "category_recommendation": {
      "decision": "create_new",
      "category_name": "AI Workforce Readiness Platform (closed-loop Knowledge -> Learning -> Skills with agentic AI). Recommended buyer-facing umbrella term: 'Workforce Readiness'. Recommended descriptive sub-line for SEO/sales: 'turn enterprise knowledge into trackable learning and measurable skills.' Confidence: Medium-High.",
      "reasoning": "Recommend CREATE NEW but anchored to existing search terms, not a pure greenfield neologism. Rationale: (1) Agent 1 Q1/Q3 establish that NO analyst sizes the converged 'learning + knowledge + skills + agentic AI' category and no incumbent owns the full closed loop - there is genuine open category space, the precondition for category creation. (2) Competitors are NOT converging on one label - they each claim a DIFFERENT term: Glean owns 'Work AI' (web search, glean.com), Cornerstone owns 'Workforce Agility' (cornerstoneondemand.com), Microsoft frames it as 'Learning Agent / Viva Learning skilling' inside Copilot (Microsoft Learn/Tech Community, GA June 2026). Divergent competitor labels = category language still forming = a window to name it. Docebo itself is already field-testing 'AI Workforce Readiness Platform' (Docebo 6-K, stocktitan.net) and the 'closed-loop / Agentic Era' framing (Docebo newsroom). (3) BUT pure category invention carries SEO/demand risk: the early-adopter ICP (Agent 2) is already searching with established terms ('enterprise AI search', 'LMS', 'AI learning content', 'skills intelligence', 'Glean alternative', 'Copilot for learning'). Therefore the strategy is a HYBRID: evangelize a new category NAME at the top of funnel (thought leadership, Inspire, analyst/Bersin 'dynamic enablement' alignment per Agent 3) while capturing existing-term search demand at mid-funnel via comparison/SEO pages (Agent 3 owned-content channel). Do NOT pick an esoteric coined word the market cannot search; lead with the plain-language closed-loop description and let 'Workforce Readiness' accrue meaning. Risk to flag: category-establishment risk is rated HIGH (Agent 1 Q10) - if Docebo evangelizes a category competitors then capture, the naming investment is stranded; mitigate by tying the category to a defensible, hard-to-copy mechanism (the closed loop on Docebo's own learning record), not just a label."
    },
    "market_narrative": "FROM -> TO. FROM: enterprises bolted point tools onto a broken workflow - an LMS that delivers courses someone built by hand, knowledge scattered across 20+ systems (employees lose 1.8-3.6 hours/day searching, Agent 1 Q8), AI search that answers a question and forgets it, and a skills strategy tracked in spreadsheets. Each tool owns one slice and none of them talk; knowledge never becomes learning, learning never proves a skill, and L&D cannot show the business it moved the needle. TO: a closed loop where agentic AI turns the company's own living knowledge into structured, trackable learning, maps that learning to skills, and measures whether capability actually went up - then feeds the result back in. WHY NOW: three forces are colliding at once (Agent 1 Q8) - task-specific AI agents are moving from <5% to a forecast 40% of enterprise apps by 2026 (Gartner), knowledge fragmentation has become a measured productivity tax, and the skills-based organization is now mainstream (~65% skills-based hiring) while only ~34% of firms run a formal reskilling program. Boards are issuing top-down AI mandates and asking L&D to prove it. The market has plenty of tools that answer questions and plenty that deliver courses; what no incumbent has built is the loop that connects knowledge to learning to proven skills - and that loop is exactly what becomes buildable the moment agentic AI can read across every source and generate against it. Docebo, a public LMS leader with an installed enterprise base, the Zive knowledge engine, 365Talents skills intelligence, and an MCP Server that makes it native inside Claude/Copilot/ChatGPT, is positioned to define and own that loop in the 2026-2028 window before the category consolidates.",
    "positioning_statement": "For HR and L&D leaders at 500+ employee enterprises whose institutional knowledge is fragmented across 20+ systems and who are under a top-down mandate to deploy AI and prove workforce capability, Docebo AgentHub is an AI Workforce Readiness platform that turns the company's own enterprise knowledge into trackable learning and measurable skills in one closed loop. Unlike legacy LMS suites (which deliver courses someone still has to build by hand) and enterprise AI search like Glean and Microsoft Copilot (which answer a question but never convert it into structured learning or prove a skill was gained), AgentHub closes the full loop - knowledge in, learning out, skills measured, on Docebo's own system-of-record learning record. So-what test: the differentiator is the CLOSED LOOP grounded in an owned learning/completion record + skills graph. Legacy LMS cannot ingest 20+ live sources and auto-generate content (Agent 1 Q3); Glean/Copilot have no LMS, no completion tracking, no learning record and cannot prove capability uplift (Agent 1 Q3); KM and skills point tools each own only one slice. None of the top 3 competitors can truthfully claim the full loop today."
  },
  "section_b_angles": {
    "positioning_angles": [
      {
        "angle_name": "Close the loop: answers aren't outcomes",
        "value_prop": "Enterprise AI search gives employees an answer and forgets it; AgentHub turns that same knowledge into structured, trackable learning and proves the skill was actually gained - so you can show capability went up, not just that questions got answered.",
        "target_persona": "Chief Learning Officer / VP L&D (champion), with the Head of AI / Chief AI Officer as co-sponsor",
        "competitive_gap": "Glean ('Work AI') and Microsoft Copilot (incl. the now-GA Learning Agent) surface and recommend knowledge but have no LMS, no completion record, and no closed skills loop - they answer but cannot prove capability uplift (Agent 1 Q3 Glean/Copilot weaknesses; web search confirms both lead with 'answer/assistant/agent', not trackable learning records).",
        "proof_points": [
          "Agent 1 Q3: Glean and Copilot have no completion tracking, no learning record, no skills loop - documented feature gap",
          "Docebo owns the system-of-record learning/completion record (core LMS asset, product brief) that AI search players structurally lack",
          "MCP Server (public beta now, GA July 2026, product brief) lets AgentHub live INSIDE Claude/Copilot/ChatGPT - so 'we already have an assistant' becomes a reason to add the loop, not skip it",
          "Skills Intelligence (365Talents) maps learning to validated skills - the measurement layer search tools do not have"
        ],
        "designation": "primary"
      },
      {
        "angle_name": "Your knowledge becomes learning - automatically",
        "value_prop": "Stop rebuilding training by hand for every new hire and product change. AgentHub's agentic AI reads across your 20+ live knowledge sources and generates structured, on-brand learning content grounded in your own source-of-truth - turning a scattered wiki into a course and a release note into a lesson.",
        "target_persona": "L&D Manager / LMS Administrator (day-to-day evaluator and secondary champion) and the CLO who must scale content",
        "competitive_gap": "Legacy LMS/HCM suites (Cornerstone Galaxy, SAP SuccessFactors, Workday Learning) deliver and track courses but cannot ingest 20+ live knowledge sources and auto-generate content from them (Agent 1 Q3) - their AI is course-assistant/skills-graph oriented, not knowledge-ingestion-to-content; content creation stays manual.",
        "proof_points": [
          "20+ native knowledge connectors: Confluence, SharePoint, Google Drive, Slack, Teams + 15 more (product brief, Agent 1 Q7)",
          "Built on Zive enterprise knowledge engine (product brief) - the ingestion layer legacy LMS lacks",
          "Agent 1 Q4: today's alternative is manual SharePoint/docs course-building and per-curriculum consultancies - labor-intensive and stale",
          "Pain quant: ~8-month time-to-productivity and skills decay outpacing course creation (Agent 2 CLO/LMS-admin pain points)",
          "FLAG: full agentic auto-generation is GA fall 2026; until then lead on live proof points (Companion, AI Tutor, MCP beta, connectors) and position agents as committed near-term roadmap, not shipped capability"
        ],
        "designation": "primary"
      },
      {
        "angle_name": "Governed, permissions-aware, EU-credible AI on employee-adjacent knowledge",
        "value_prop": "An agentic system reading across 20+ sources and employee data raises the security, governance, and data-residency bar. AgentHub is built to respect existing permissions and, via Zive's European roots, offers a credible EU data-residency and governance posture for compliance-led buyers - turning the CISO/DPO gate from a blocker into a reason to choose Docebo.",
        "target_persona": "CISO / Head of Information Security and (in EMEA/DACH) the DPO and works council - the blocker; secondary resonance with the Director of IT",
        "competitive_gap": "Most US-headquartered competitors lack BSI C5, EU data residency, and German-language DPAs (Agent 1 Q2 underserved_geographies); Glean/Copilot face EU AI Act and residency scrutiny. Zive's German roots are a genuine, defensible wedge no US-native LMS/search vendor easily matches.",
        "proof_points": [
          "Zive is a German enterprise AI/knowledge platform (product brief) - structural basis for EU residency and DACH trust",